<?xml version="1.0" encoding="UTF-8"?>
<xsd:schema xmlns:xsd="http://www.w3.org/2001/XMLSchema" xmlns:od="urn:schemas-microsoft-com:officedata">
<xsd:element name="dataroot">
<xsd:complexType>
<xsd:sequence>
<xsd:element ref="Bikes" minOccurs="0" maxOccurs="unbounded"/>
</xsd:sequence>
<xsd:attribute name="generated" type="xsd:dateTime"/>
</xsd:complexType>
</xsd:element>
<xsd:element name="Bikes">
<xsd:annotation>
<xsd:appinfo>
<od:index index-name="PrimaryKey" index-key="ID " primary="yes" unique="yes" clustered="no"/>
<od:index index-name="Shipping_Code" index-key="Shipping_Code " primary="no" unique="no" clustered="no"/>
</xsd:appinfo>
</xsd:annotation>
<xsd:complexType>
<xsd:sequence>
<xsd:element name="ID" minOccurs="1" od:jetType="autonumber" od:sqlSType="int" od:autoUnique="yes" od:nonNullable="yes" type="xsd:int"/>
<xsd:element name="Bike" minOccurs="0" od:jetType="text" od:sqlSType="nvarchar">
<xsd:simpleType>
<xsd:restriction base="xsd:string">
<xsd:maxLength value="250"/>
</xsd:restriction>
</xsd:simpleType>
</xsd:element>
<xsd:element name="Short_Description" minOccurs="0" od:jetType="memo" od:sqlSType="ntext">
<xsd:simpleType>
<xsd:restriction base="xsd:string">
<xsd:maxLength value="536870910"/>
</xsd:restriction>
</xsd:simpleType>
</xsd:element>
<xsd:element name="Long_Description" minOccurs="0" od:jetType="memo" od:sqlSType="ntext">
<xsd:simpleType>
<xsd:restriction base="xsd:string">
<xsd:maxLength value="536870910"/>
</xsd:restriction>
</xsd:simpleType>
</xsd:element>
<xsd:element name="Full_Payment" minOccurs="0" od:jetType="currency" od:sqlSType="money" type="xsd:double"/>
<xsd:element name="Lowest_Payment" minOccurs="0" od:jetType="currency" od:sqlSType="money" type="xsd:double"/>
<xsd:element name="Picture_Thumbnail" minOccurs="0" od:jetType="text" od:sqlSType="nvarchar">
<xsd:simpleType>
<xsd:restriction base="xsd:string">
<xsd:maxLength value="250"/>
</xsd:restriction>
</xsd:simpleType>
</xsd:element>
<xsd:element name="Picture_Small" minOccurs="0" od:jetType="text" od:sqlSType="nvarchar">
<xsd:simpleType>
<xsd:restriction base="xsd:string">
<xsd:maxLength value="250"/>
</xsd:restriction>
</xsd:simpleType>
</xsd:element>
<xsd:element name="Picture_Large" minOccurs="0" od:jetType="text" od:sqlSType="nvarchar">
<xsd:simpleType>
<xsd:restriction base="xsd:string">
<xsd:maxLength value="250"/>
</xsd:restriction>
</xsd:simpleType>
</xsd:element>
<xsd:element name="Shipping_Code" minOccurs="0" od:jetType="text" od:sqlSType="nvarchar">
<xsd:simpleType>
<xsd:restriction base="xsd:string">
<xsd:maxLength value="250"/>
</xsd:restriction>
</xsd:simpleType>
</xsd:element>
<xsd:element name="Shipping_Code_Islands" minOccurs="0" od:jetType="text" od:sqlSType="nvarchar">
<xsd:simpleType>
<xsd:restriction base="xsd:string">
<xsd:maxLength value="250"/>
</xsd:restriction>
</xsd:simpleType>
</xsd:element>
<xsd:element name="Shipping_Code_Canada" minOccurs="0" od:jetType="text" od:sqlSType="nvarchar">
<xsd:simpleType>
<xsd:restriction base="xsd:string">
<xsd:maxLength value="250"/>
</xsd:restriction>
</xsd:simpleType>
</xsd:element>
<xsd:element name="Page" minOccurs="0" od:jetType="text" od:sqlSType="nvarchar">
<xsd:simpleType>
<xsd:restriction base="xsd:string">
<xsd:maxLength value="250"/>
</xsd:restriction>
</xsd:simpleType>
</xsd:element>
<xsd:element name="SortOrder" minOccurs="0" od:jetType="longinteger" od:sqlSType="int" type="xsd:int"/>
<xsd:element ref="Bike_Options" minOccurs="0" maxOccurs="unbounded"/>
</xsd:sequence>
</xsd:complexType>
</xsd:element>
<xsd:element name="Bike_Options">
<xsd:annotation>
<xsd:appinfo>
<od:index index-name="PrimaryKey" index-key="ID " primary="yes" unique="yes" clustered="no"/>
<od:index index-name="Bike_ID" index-key="Bike_ID " primary="no" unique="no" clustered="no"/>
<od:index index-name="BikesBike_Options" index-key="Bike_ID " primary="no" unique="no" clustered="no"/>
<od:index index-name="ID" index-key="ID " primary="no" unique="no" clustered="no"/>
<od:index index-name="SKU_1_Payment_Shipping_Code" index-key="SKU_1_Payment_Handling_Code " primary="no" unique="no" clustered="no"/>
<od:index index-name="SKU_4_Payment_Handling_Code" index-key="SKU_4_Payment_Handling_Code " primary="no" unique="no" clustered="no"/>
<od:index index-name="SKU_4_Payment_Handling_Code1" index-key="SKU_10_Payment_Handling_Code " primary="no" unique="no" clustered="no"/>
</xsd:appinfo>
</xsd:annotation>
<xsd:complexType>
<xsd:sequence>
<xsd:element name="ID" minOccurs="1" od:jetType="autonumber" od:sqlSType="int" od:autoUnique="yes" od:nonNullable="yes" type="xsd:int"/>
<xsd:element name="Bike_ID" minOccurs="0" od:jetType="longinteger" od:sqlSType="int" type="xsd:int"/>
<xsd:element name="Sex" minOccurs="0" od:jetType="text" od:sqlSType="nvarchar">
<xsd:simpleType>
<xsd:restriction base="xsd:string">
<xsd:maxLength value="1"/>
</xsd:restriction>
</xsd:simpleType>
</xsd:element>
<xsd:element name="Sizes" minOccurs="0" od:jetType="text" od:sqlSType="nvarchar">
<xsd:simpleType>
<xsd:restriction base="xsd:string">
<xsd:maxLength value="250"/>
</xsd:restriction>
</xsd:simpleType>
</xsd:element>
<xsd:element name="Height" minOccurs="0" od:jetType="text" od:sqlSType="nvarchar">
<xsd:simpleType>
<xsd:restriction base="xsd:string">
<xsd:maxLength value="250"/>
</xsd:restriction>
</xsd:simpleType>
</xsd:element>
<xsd:element name="Inseam" minOccurs="0" od:jetType="text" od:sqlSType="nvarchar">
<xsd:simpleType>
<xsd:restriction base="xsd:string">
<xsd:maxLength value="250"/>
</xsd:restriction>
</xsd:simpleType>
</xsd:element>
<xsd:element name="SKU_1_Payment" minOccurs="0" od:jetType="text" od:sqlSType="nvarchar">
<xsd:simpleType>
<xsd:restriction base="xsd:string">
<xsd:maxLength value="250"/>
</xsd:restriction>
</xsd:simpleType>
</xsd:element>
<xsd:element name="SKU_1_Payment_Price" minOccurs="0" od:jetType="currency" od:sqlSType="money" type="xsd:double"/>
<xsd:element name="SKU_1_Payment_Desc" minOccurs="0" od:jetType="text" od:sqlSType="nvarchar">
<xsd:simpleType>
<xsd:restriction base="xsd:string">
<xsd:maxLength value="250"/>
</xsd:restriction>
</xsd:simpleType>
</xsd:element>
<xsd:element name="SKU_1_Payment_Handling_Code" minOccurs="0" od:jetType="text" od:sqlSType="nvarchar">
<xsd:simpleType>
<xsd:restriction base="xsd:string">
<xsd:maxLength value="250"/>
</xsd:restriction>
</xsd:simpleType>
</xsd:element>
<xsd:element name="SKU_4_Payment" minOccurs="0" od:jetType="text" od:sqlSType="nvarchar">
<xsd:simpleType>
<xsd:restriction base="xsd:string">
<xsd:maxLength value="250"/>
</xsd:restriction>
</xsd:simpleType>
</xsd:element>
<xsd:element name="SKU_4_Payment_Price" minOccurs="0" od:jetType="currency" od:sqlSType="money" type="xsd:double"/>
<xsd:element name="SKU_4_Payment_Desc" minOccurs="0" od:jetType="text" od:sqlSType="nvarchar">
<xsd:simpleType>
<xsd:restriction base="xsd:string">
<xsd:maxLength value="250"/>
</xsd:restriction>
</xsd:simpleType>
</xsd:element>
<xsd:element name="SKU_4_Payment_Handling_Code" minOccurs="0" od:jetType="text" od:sqlSType="nvarchar">
<xsd:simpleType>
<xsd:restriction base="xsd:string">
<xsd:maxLength value="250"/>
</xsd:restriction>
</xsd:simpleType>
</xsd:element>
<xsd:element name="SKU_10_Payment" minOccurs="0" od:jetType="text" od:sqlSType="nvarchar">
<xsd:simpleType>
<xsd:restriction base="xsd:string">
<xsd:maxLength value="250"/>
</xsd:restriction>
</xsd:simpleType>
</xsd:element>
<xsd:element name="SKU_10_Payment_Price" minOccurs="0" od:jetType="currency" od:sqlSType="money" type="xsd:double"/>
<xsd:element name="SKU_10_Payment_Desc" minOccurs="0" od:jetType="text" od:sqlSType="nvarchar">
<xsd:simpleType>
<xsd:restriction base="xsd:string">
<xsd:maxLength value="250"/>
</xsd:restriction>
</xsd:simpleType>
</xsd:element>
<xsd:element name="SKU_10_Payment_Handling_Code" minOccurs="0" od:jetType="text" od:sqlSType="nvarchar">
<xsd:simpleType>
<xsd:restriction base="xsd:string">
<xsd:maxLength value="250"/>
</xsd:restriction>
</xsd:simpleType>
</xsd:element>
<xsd:element name="Picture_Cart" minOccurs="0" od:jetType="memo" od:sqlSType="ntext">
<xsd:simpleType>
<xsd:restriction base="xsd:string">
<xsd:maxLength value="536870910"/>
</xsd:restriction>
</xsd:simpleType>
</xsd:element>
<xsd:element name="Active" minOccurs="0" od:jetType="text" od:sqlSType="nvarchar">
<xsd:simpleType>
<xsd:restriction base="xsd:string">
<xsd:maxLength value="1"/>
</xsd:restriction>
</xsd:simpleType>
</xsd:element>
</xsd:sequence>
</xsd:complexType>
</xsd:element>
</xsd:schema>
